title,slug,content,excerpt,author_email,category_name,tags,is_published,is_featured,published_at,reading_time,featured_image,meta_title,meta_description,meta_keywords
"Essential Pool Maintenance Guide",,"<p>Maintaining your pool properly is crucial for ensuring crystal clear water and extending the life of your pool equipment. This comprehensive guide covers everything you need to know about pool maintenance.</p><p>Regular maintenance includes checking water chemistry, cleaning filters, and removing debris. By following a consistent maintenance schedule, you can prevent costly repairs and enjoy your pool year-round.</p>","Complete guide to maintaining your swimming pool year-round",admin@hexagonservicesolutions.com,"Pool Care","pool maintenance, cleaning, water chemistry",1,1,"2024-01-15 09:00:00",7,images/blog/pool-maintenance-guide.jpg,"Essential Pool Maintenance Guide | Expert Tips","Learn professional pool maintenance techniques to keep your pool pristine","pool maintenance, pool care, swimming pool cleaning"
"Pool Resurfacing: When and Why",,"<p>Is your pool showing signs of wear? Cracks, rough surfaces, or persistent staining may indicate it's time for resurfacing. This article explains when to resurface your pool and the benefits it provides.</p><p>Pool resurfacing not only improves aesthetics but also extends your pool's lifespan and can reduce maintenance costs. Learn about different resurfacing options and their costs.</p>","Discover when your pool needs resurfacing and the benefits",admin@hexagonservicesolutions.com,"Pool Renovation","pool resurfacing, renovation, repair",1,0,"2024-02-01 10:30:00",5,images/blog/pool-resurfacing-when.jpg,"When to Resurface Your Pool | Expert Advice","Know the signs that indicate your pool needs resurfacing","pool resurfacing, pool renovation, swimming pool repair"
"Top 5 Pool Safety Tips for Families",,"<p>Pool safety is paramount when you have children or pets. These five essential safety tips will help you create a secure swimming environment for your family.</p><p>From proper fencing to chemical storage, we cover all aspects of pool safety. Implementing these measures can prevent accidents and give you peace of mind.</p>","Essential pool safety measures every family should implement",admin@hexagonservicesolutions.com,"Pool Safety","pool safety, family, children, prevention",1,1,"2024-03-10 14:00:00",4,images/blog/pool-safety-tips.jpg,"Pool Safety Tips for Families | Keep Kids Safe","Important pool safety guidelines for families with children","pool safety, swimming pool safety, child safety"
"Energy-Efficient Pool Equipment",,"<p>Reduce your pool's operating costs with energy-efficient equipment. Modern pool pumps, heaters, and LED lighting can significantly lower your energy bills.</p><p>This guide reviews the latest energy-saving pool technologies and calculates potential savings. Make your pool more eco-friendly while saving money.</p>","Save money with energy-efficient pool equipment and technology",admin@hexagonservicesolutions.com,"Pool Equipment","energy efficiency, pool equipment, cost savings",1,0,"2024-03-25 11:00:00",6,images/blog/energy-efficient-equipment.jpg,"Energy-Efficient Pool Equipment Guide","Discover how to reduce pool operating costs with efficient equipment","pool equipment, energy savings, eco-friendly pools"
"Preparing Your Pool for Summer",,"<p>Get your pool ready for the summer swimming season with our comprehensive preparation checklist. From water chemistry to equipment inspection, we cover everything you need.</p><p>Proper spring preparation ensures your pool is safe, clean, and ready for months of enjoyment. Follow our step-by-step guide for the best results.</p>","Complete checklist for summer pool preparation",admin@hexagonservicesolutions.com,"Seasonal Care","summer prep, pool opening, maintenance",1,1,"2024-04-15 08:30:00",5,images/blog/summer-pool-prep.jpg,"Summer Pool Preparation Guide | Get Ready to Swim","Essential steps to prepare your pool for summer season","pool preparation, summer pool care, pool opening"
"Understanding Pool Water Chemistry",,"<p>Balanced water chemistry is the foundation of a healthy pool. This guide explains pH, alkalinity, chlorine levels, and other crucial chemical parameters.</p><p>Learn how to test your water, interpret results, and make proper adjustments. Proper water chemistry prevents algae, protects equipment, and ensures swimmer comfort.</p>","Master the basics of pool water chemistry and testing",admin@hexagonservicesolutions.com,"Pool Care","water chemistry, pH, chlorine, testing",1,0,"2024-04-28 13:00:00",8,images/blog/water-chemistry.jpg,"Pool Water Chemistry Explained | Complete Guide","Understand and maintain perfect pool water chemistry","pool chemistry, water testing, pH balance"
"Pool Tile Cleaning and Maintenance",,"<p>Keep your pool tiles sparkling with proper cleaning and maintenance techniques. This guide covers everything from calcium removal to grout repair.</p><p>Regular tile maintenance prevents buildup and extends the life of your pool's finish. Learn professional cleaning methods and preventive measures.</p>","Professional techniques for cleaning and maintaining pool tiles",admin@hexagonservicesolutions.com,"Pool Care","tile cleaning, maintenance, calcium removal",1,0,"2024-05-05 10:00:00",4,images/blog/tile-cleaning.jpg,"Pool Tile Cleaning Guide | Remove Calcium Buildup","Expert tips for maintaining clean and beautiful pool tiles","pool tile cleaning, calcium removal, tile maintenance"
"Choosing the Right Pool Filter",,"<p>Your pool filter is crucial for maintaining clean, clear water. This comparison guide helps you choose between sand, cartridge, and DE filters.</p><p>We examine the pros and cons of each filter type, including maintenance requirements and costs. Make an informed decision for your pool's filtration needs.</p>","Compare pool filter types and choose the best for your needs",admin@hexagonservicesolutions.com,"Pool Equipment","filters, equipment, comparison, maintenance",1,0,"2024-05-20 09:30:00",6,images/blog/pool-filters.jpg,"Pool Filter Comparison Guide | Sand vs Cartridge vs DE","Choose the perfect pool filter system for your needs","pool filters, filtration systems, pool equipment"
"Winterizing Your Pool: Complete Guide",,"<p>Properly winterizing your pool protects it from freeze damage and makes spring opening easier. This comprehensive guide covers all winterization steps.</p><p>From balancing water chemistry to installing a winter cover, we detail everything needed for successful pool winterization. Protect your investment during the off-season.</p>","Step-by-step pool winterization guide for cold climates",admin@hexagonservicesolutions.com,"Seasonal Care","winterizing, pool closing, winter care",1,1,"2024-06-01 11:30:00",7,images/blog/pool-winterizing.jpg,"Pool Winterization Guide | Protect Your Pool","Complete instructions for properly winterizing your swimming pool","pool winterizing, winter pool care, pool closing"
"Pool Landscaping Ideas",,"<p>Transform your pool area into a backyard oasis with creative landscaping ideas. From tropical themes to modern minimalist designs, find inspiration for your pool landscape.</p><p>We cover plant selection, hardscaping options, lighting, and safety considerations. Create a beautiful and functional poolside environment.</p>","Creative landscaping ideas to enhance your pool area",admin@hexagonservicesolutions.com,"Design & Aesthetics","landscaping, design, plants, hardscaping",1,0,"2024-06-15 14:00:00",5,images/blog/pool-landscaping.jpg,"Pool Landscaping Ideas | Transform Your Backyard","Beautiful landscaping designs for around your swimming pool","pool landscaping, backyard design, poolside plants"